Object Type,Title,Item ARK,Parent ARK,File Name,AltTitle.other,collection.physical,Contents note,Date.created,Date.normalized,Description.latitude,Description.longitude,Description.note,Format.dimensions,Format.extent,Format.medium,Genre,Language,Local identifier,Name.creator,Named subject,Note,Place of origin,Publisher.publisherName,Repository,Resource type,Rights.copyrightStatus,Rights.rightsHolderContact,Statement of Responsibility,Subject,Subject geographic,Subject temporal,Creator
Work,Church Service: Commemoration of the 375th Anniversary of the Parliament of Barbados,ark:/21198/z1vx28kn,ark:/21198/z1rf7n15,afddsf/barb_eph_cch0077.pdf,,Ephemera Collection,,"June 15, 2014",2014-06-15,13.1939,59.5432,"Order of service for the commemoration of the 375th anniversary of the the Parliament. The booklet mentions that Barbados' Parliament is ""the third oldest in the Commonwealth and stands as a bastion of independence and democracy in the current era.""",21.3 x 13.8 cm,30 pages,,programs (documents)|~|booklets,,,Government of Barbados,,,Barbados,,Barbados Department of Archives,text,public domain,Barbados Department of Archives,,Anniversaries|~|Politics and government|~|Church services,Saint Michael (Barbados),21st century,
Work,Easter Sunday Celebration,ark:/21198/z1r51hsb,ark:/21198/z1rf7n15,afddsf/barb_eph_cch0078.pdf,,Ephemera Collection,,Between 1990 and 2010,1990/2010,13.1939,59.5432,"Invitation for Easter Sunday celebrations for all persons who were baptized, confirmed or married at St. Michael's Cathedral.",21.6 cm x 14 cm,2 pages,,fliers (printed matter)|~|invitations,,,St. Michael's Cathedral Church,,,Barbados,,Barbados Department of Archives,text,public domain,Barbados Department of Archives,,Church|~|Church work with families|~|Socioeconomic conditions and development--Community development,Saint Michael (Barbados),20th century/21st century,
Work,Easter Sunday Celebration: Holy Innocents' Church,ark:/21198/z1md0s1k,ark:/21198/z1rf7n15,afddsf/barb_eph_cch0079.pdf,,Ephemera Collection,,1974,1974-01-01/1974-12-31,13.1939,59.5432,"Easter Day and Easter week program of celebrations at Holy Innocents' Church, St. Thomas.",21.9 cm x 14.3 cm,3 pages,,programs (documents),,,Holy Innocents' Church,,,Barbados,,Barbados Department of Archives,text,public domain,Barbados Department of Archives,,Easter|~|Church|~|Religion--Rites and ceremonies,Saint Thomas (Barbados),20th century,
Work,St. Michael's Cathedral Barbados: Judicial Convocation,ark:/21198/z1gq8qsh,ark:/21198/z1rf7n15,afddsf/barb_eph_cch0080.pdf,,Ephemera Collection,,Between 1990 and 2010,1990/2010,13.1939,59.5432,A card and hymn sheet of the Judicial Convocation at St. Michael's Cathedral.,22.1 cm x 17.8 cm,5 pages,,programs (documents),,,St. Michael's Cathedral Church,,,Barbados,,Barbados Department of Archives,text,public domain,Barbados Department of Archives,,Church|~|Anniversaries|~|Bar associations|~|Church services,Saint Michael (Barbados),20th century/21st century,
Work,Recital of Xmas Music: St. Mary's Church,ark:/21198/z1bz8014,ark:/21198/z1rf7n15,afddsf/barb_eph_cch0081.pdf,,Ephemera Collection,,"January 1, 1961",1961-01-01,13.1939,59.5432,Recital of Christmas music at St. Mary's Church.,20.3 cm x 13.6 cm,20 pages,,programs (documents)|~|concert programs,,,St. Mary's Church,,,Barbados,,Barbados Department of Archives,text,public domain,Barbados Department of Archives,,Church|~|Christmas music|~|Arts and culture--Music|~|Concerts,Saint Michael (Barbados),20th century,
Work,Recital of Xmas Music: St. Mary's Church,ark:/21198/z176779q,ark:/21198/z1rf7n15,afddsf/barb_eph_cch0082.pdf,,Ephemera Collection,,"December 27, 1964",1964-12-27,13.1939,59.5432,Recital of Christmas music at St. Mary's Church.,20.5 cm x 13.1 cm,15 pages,,programs (documents)|~|concert programs,,,St. Mary's Church,,,Barbados,,Barbados Department of Archives,text,public domain,Barbados Department of Archives,,Church|~|Christmas music|~|Arts and culture--Music|~|Concerts,Saint Michael (Barbados),20th century,
Work,Recital of Music at St. Mary's Church,ark:/21198/z13f6gnw,ark:/21198/z1rf7n15,afddsf/barb_eph_cch0083.pdf,,Ephemera Collection,,"September 21, 1960",1960-09-21,13.1939,59.5432,Recital of music by the Barbados Police Band and Soloists.,16.4 cm x 10.8 cm,3 pages,,programs (documents)|~|concert programs,,,St. Mary's Church,,,Barbados,,Barbados Department of Archives,,public domain,Barbados Department of Archives,,Church|~|Arts and culture--Music|~|Concerts|~|Police|~|Police-community relations,Saint Michael (Barbados),20th century,
Work,Recital of Xmas Music: The Barbados Choral Society and The Cathedral Choir,ark:/21198/z1zp604j,ark:/21198/z1rf7n15,afddsf/barb_eph_cch0084.pdf,,Ephemera Collection,,"December 16, 1964",1964-12-16,13.1939,59.5432,"Recital of Christmas music by the Barbados Choral Society and the St. Michael's Cathedral Choir, held at St. Michael's Cathedral.",26.9 cm x 19.9 cm,16 pages,,programs (documents)|~|concert programs,,,Barbados Choral Society,,,Barbados,,Barbados Department of Archives,text,public domain,Barbados Department of Archives,,Church|~|Christmas music|~|Arts and culture--Music|~|Concerts|~|Choirs (Music),Saint Michael (Barbados),20th century,
Work,Recital of Christmas Music at the Diocesan House,ark:/21198/z1tx57dt,ark:/21198/z1rf7n15,afddsf/barb_eph_cch0085.pdf,,Ephemera Collection,,"December 17, 1966",1966-12-17,13.1939,59.5432,Recital of Christmas music held at the Diocesan House.,22.8 cm x 15.7 cm,5 pages,,programs (documents)|~|concert programs,,,Diocese of Barbados,,,Barbados,,Barbados Department of Archives,text,public domain,Barbados Department of Archives,,Church|~|Christmas music|~|Arts and culture--Music|~|Concerts|~|Choirs (Music),Saint Michael (Barbados),20th century,
Work,Methodist Church of Barbados: A Festival of Flowers,ark:/21198/z1q54gmh,ark:/21198/z1rf7n15,afddsf/barb_eph_cch0086.pdf,,Ephemera Collection,,"April 29, 1988",1988-04-29,13.1939,59.5432,"Invitation, program of events, and list of floral arrangements for the flower festival held at the Providence Methodist Church in celebration of 200 years of Methodism in Barbados.",21.6 cm x 11.7 cm,14 pages,,booklets,,,Methodist Church,,,Barbados,,Barbados Department of Archives,text,public domain,Barbados Department of Archives,,Church|~|Socioeconomic conditions and development--Community development|~|Flower festivals,Christ Church (Barbados),20th century,
Work,Recital of Christmas Music at the Hawthorn Memorial Methodist Church,ark:/21198/z1kh2f9h,ark:/21198/z1rf7n15,afddsf/barb_eph_cch0087.pdf,,Ephemera Collection,,"December 18, 1967",1967-12-18,13.1939,59.5432,Recital of Christmas music by the Sine Nomine Singers held at the Hawthorn Memorial Methodist Church.,21.6 cm x 17.7 cm,11 pages,,programs (documents)|~|concert programs,,,Hawthorn Memorial Methodist Church,,,Barbados,,Barbados Department of Archives,text,public domain,Barbados Department of Archives,,Church|~|Christmas music|~|Arts and culture -- Music|~|Concerts|~|Choirs (Music),Christ Church (Barbados),20th century,
Work,Prayer Card: Charismatic Renewal (Holy Spirit) Group,ark:/21198/z1fr1pks,ark:/21198/z1rf7n15,afddsf/barb_eph_cch0088.pdf,,Ephemera Collection,,Between 1990 and 2010,1990/2010,13.1939,59.5432,"Prayer Card for the prayer meeting of the Charismatic Renewal (Holy Spirit) Group held at the St. Cyprian Church, George St, 7th Ave, St. Michael, Barbados.",13.6 cm x 11.9 cm,4 pages,,brochures,,,Charismatic Renewal (Holy Spirit) Group,,,Barbados,,Barbados Department of Archives,text,public domain,Barbados Department of Archives,,Prayer|~|Religion -- Rites and ceremonies,Saint Michael (Barbados),20th century/21st century,
Work,Recital of Christmas Music: St. Ambrose Church,ark:/21198/z1b00xvc,ark:/21198/z1rf7n15,afddsf/barb_eph_cch0089.pdf,,Ephemera Collection,,"December 31, 1967",1967-12-31,13.1939,59.5432,Recital of Christmas music held at St. Ambrose Church.,21.5 cm x 15.1 cm,3 pages,,programs (documents)|~|concert programs,,,St. Ambrose Church,,,Barbados,,Barbados Department of Archives,text,public domain,Barbados Department of Archives,,Church|~|Christmas music|~|Arts and culture -- Music|~|Concerts,Saint Michael (Barbados),20th century,
Work,Christmas Concert: Barbados Choral Society,ark:/21198/z167066b,ark:/21198/z1rf7n15,afddsf/barb_eph_cch0090.pdf,,Ephemera Collection,,"December 18, 1968",1968-12-18,13.1939,59.5432,"Christmas concert by the Barbados Choral Society held at St. Michael's Cathedral, Bridgetown.",23.6 cm x 16.7 cm,9 pages,,programs (documents)|~|concert programs,,,Barbados Choral Society,,,Barbados,,Barbados Department of Archives,text,public domain,Barbados Department of Archives,,Church|~|Christmas music|~|Arts and culture -- Music|~|Concerts|~|Choirs (Music),Saint Michael (Barbados),20th century,
Work,Silver Jubilee Thanksgiving Service: Solomon's Temple Lodge No.8,ark:/21198/z12f9fg2,ark:/21198/z1rf7n15,afddsf/barb_eph_cch0091.pdf,,Ephemera Collection,,"September 16, 1957",1957-09-16,13.1939,59.5432,"Thanksgiving service for the Silver Jubilee of Solomon's Temple Lodge No. 8 by the Independent United Order of Mechanics (Western Hemisphere Inc.) held at Mechanics Hall, 118 Roebuck Street, Bridgetown.",21.5 cm x 14 cm,4 pages,,programs (documents),,,Independent United Order of Mechanics,,,Barbados,,Barbados Department of Archives,text,public domain,Barbados Department of Archives,,Anniversaries|~|Church services|~|Fraternal organizations,Saint Michael (Barbados),20th century,
Work,Recital of Christmas Music at the Diocesan House,ark:/21198/z1xp8xzx,ark:/21198/z1rf7n15,afddsf/barb_eph_cch0092.pdf,,Ephemera Collection,,"December 13, 1969",1969-12-13,13.1939,59.5432,Recital of Christmas music by the Sine Nomine Singers held at the Diocesan House.,21.6 cm x 13.9 cm,12 pages,,programs (documents)|~|concert programs,,,Diocese of Barbados,,,Barbados,,Barbados Department of Archives,text,public domain,Barbados Department of Archives,,Church|~|Christmas music|~|Arts and culture -- Music|~|Concerts|~|Choirs (Music),Saint Michael (Barbados),20th century,
Work,Recital of Christmas Music: St. George's Parish Church,ark:/21198/z1sx866j,ark:/21198/z1rf7n15,afddsf/barb_eph_cch0093.pdf,,Ephemera Collection,,"December 28, 1969",1969-12-28,13.1939,59.5432,Recital of Christmas music at St. George's Parish Church with proceeds being in aid of choir funds.,19.9 cm x 15.7 cm,11 pages,,programs (documents)|~|concert programs,,,St. George's Parish Church,,,Barbados,,Barbados Department of Archives,text,public domain,Barbados Department of Archives,,Church|~|Christmas music|~|Arts and culture -- Music|~|Concerts|~|Choirs (Music),Saint George (Barbados),20th century,
Work,Barbados Choral Society: Christmas Recital 1970,ark:/21198/z1p864xw,ark:/21198/z1rf7n15,afddsf/barb_eph_cch0094.pdf,,Ephemera Collection,,"December 16, 1970",1970-12-16,13.1939,59.5432,"Program for the Barbados Choral Society Christmas Recital 1970 held at St. Michael's Cathedral. Soloists: Doris Provencal, Grace Hackett, Colin Norville, Lloyd Brooks, with Organist John Fletcher.",22.9 cm x 15.8 cm,4 pages,,programs (documents)|~|concert programs,,,Barbados Choral Society,,,Barbados,,Barbados Department of Archives,text,public domain,Barbados Department of Archives,,Church|~|Christmas music|~|Arts and culture -- Music|~|Concerts|~|Choirs (Music),Saint Michael (Barbados),20th century,
Work,Recital of Christmas Music at St. Philip's Parish Church,ark:/21198/z1jh5d54,ark:/21198/z1rf7n15,afddsf/barb_eph_cch0095.pdf,,Ephemera Collection,,"December 27, 1970",1970-12-27,13.1939,59.5432,Program of recital held at St. Philip's Parish Church at 8:00 P.M. Admission was $1.00 for adults and 50c for children.,21.6 cm x 16.4 cm,2 pages,,programs (documents)|~|concert programs,,,Philip's Parish Church,,,Barbados,,Barbados Department of Archives,text,public domain,Barbados Department of Archives,,Church|~|Christmas music|~|Arts and culture -- Music|~|Concerts|~|Choirs (Music),Saint Philip (Barbados),20th century,
Work,Christmas Festival with the Cecilian Singers,ark:/21198/z1dr4ngv,ark:/21198/z1rf7n15,afddsf/barb_eph_cch0096.pdf,,Ephemera Collection,,"December 19, 1974",1974-12-19,13.1939,59.5432,"Program for Christmas music festival featuring the Cecilian Singers, conducted by Doris Provencal, held at the Ursuline Convent Hall.",21.3 cm x 13.6 cm,11 pages,,programs (documents)|~|concert programs,,,Cecilian Singers,,,Barbados,,Barbados Department of Archives,text,public domain,Barbados Department of Archives,,Church|~|Christmas music|~|Arts and culture -- Music|~|Concerts|~|Choirs (Music),Saint Michael (Barbados),20th century,
Work,Christmas Festival with the Cecilian Singers,ark:/21198/z1903wsw,ark:/21198/z1rf7n15,afddsf/barb_eph_cch0097.pdf,,Ephemera Collection,,Between 1972 and 1975,1972/1975,13.1939,59.5432,"Program for Christmas music festival featuring the Cecilian Singers, conducted by Doris Provencal, held at the Ursuline Convent Hall on December 16 (no year).",21.6 cm x 13.8 cm,8 pages,,programs (documents)|~|concert programs,,,Cecilian Singers,,,Barbados,,Barbados Department of Archives,text,public domain,Barbados Department of Archives,,Church|~|Christmas music|~|Arts and culture -- Music|~|Concerts|~|Choirs (Music),Saint Michael (Barbados),20th century,
Work,Christmas Concert with the Cecilian Singers,ark:/21198/z157352z,ark:/21198/z1rf7n15,afddsf/barb_eph_cch0098.pdf,,Ephemera Collection,,"December 18, 1976",1976-12-18,13.1939,59.5432,"Program for Christmas music concert featuring the Cecilian Singers, conducted by Doris Provencal, held at the Ursuline Convent Hall on December 18, 1976.",22 cm x 13.7 cm,11 pages,,programs (documents)|~|concert programs,,,Cecilian Singers,,,Barbados,,Barbados Department of Archives,text,public domain,Barbados Department of Archives,,Church|~|Christmas music|~|Arts and culture -- Music|~|Concerts|~|Choirs (Music),Saint Michael (Barbados),20th century,
Work,Christmas Festival with the Cecilian Singers,ark:/21198/z11g2d9s,ark:/21198/z1rf7n15,afddsf/barb_eph_cch0099.pdf,,Ephemera Collection,,Between 1972 and 1978,1972/1978,13.1939,59.5432,"Program for Christmas music festival featuring the Cecilian Singers, conducted by Doris Provencal, held at the Ursuline Convent Hall on December 14 (no year).",21.6 cm x 13.7 cm,11 pages,,programs (documents)|~|concert programs,,,Cecilian Singers,,,Barbados,,Barbados Department of Archives,text,public domain,Barbados Department of Archives,,Church|~|Christmas music|~|Arts and culture -- Music|~|Concerts|~|Choirs (Music),Saint Michael (Barbados),20th century,
Work,Christmas Festival with the Cecilian Singers,ark:/21198/z1wt0m88,ark:/21198/z1rf7n15,afddsf/barb_eph_cch0100.pdf,,Ephemera Collection,,Between 1973 and 1978,1972/1978,13.1939,59.5432,"Program for Christmas music festival featuring the Cecilian Singers, conducted by Doris Provencal, held at the Ursuline Convent Hall on December 22 (no year).",21 cm x 13.4 cm,11 pages,,programs (documents)|~|concert programs,,,Cecilian Singers,,,Barbados,,Barbados Department of Archives,text,public domain,Barbados Department of Archives,,Church|~|Christmas music|~|Arts and culture -- Music|~|Concerts|~|Choirs (Music),Saint Michael (Barbados),20th century,
Work,Christmas Concert with the Cecilian Singers,ark:/21198/z1s19vhv,ark:/21198/z1rf7n15,afddsf/barb_eph_cch0101.pdf,,Ephemera Collection,,"December 16, 1978",1978-12-16,13.1939,59.5432,"Program of a Christmas music concert featuring the Barbados Symphonia and the Cecilian Singers, conducted by Doris Provencal, held at the Ursuline Convent Hall on December 16, 1978.",22 cm x 13.8 cm,11 pages,,programs (documents)|~|concert programs,,,Cecilian Singers,,,Barbados,,Barbados Department of Archives,text,public domain,Barbados Department of Archives,,Church|~|Christmas music|~|Arts and culture -- Music|~|Concerts|~|Choirs (Music),Saint Michael (Barbados),20th century,
Work,Annual Recital of Christmas Music,ark:/21198/z1n893sh,ark:/21198/z1rf7n15,afddsf/barb_eph_cch0102.pdf,,Ephemera Collection,,"January 1, 1978",1978-01-01,13.1939,59.5432,"Program for recital of Christmas music by the Augmented St. Mary's Choir, held at St. Mary's Church.",21.6 cm x 16.6 cm,3 pages,,programs (documents)|~|concert programs,,,St. Mary's Church,,,Barbados,,Barbados Department of Archives,text,public domain,Barbados Department of Archives,,Church|~|Christmas music|~|Arts and culture -- Music|~|Concerts|~|Choirs (Music),Saint Michael (Barbados),20th century,
Work,Christmas Recital by the Barclay Singers,ark:/21198/z1hh8c26,ark:/21198/z1rf7n15,afddsf/barb_eph_cch0103.pdf,,Ephemera Collection,,"December 16, 1979",1979-12-16,13.1939,59.5432,"Program for Christmas recital by the Barclay Singers accompanied by Michael Gill, held at St. James Parish Church.",20.3 cm x 13 cm,5 pages,,programs (documents)|~|concert programs,,,St. James Parish Church,,,Barbados,,Barbados Department of Archives,text,public domain,Barbados Department of Archives,,Church|~|Christmas music|~|Arts and culture -- Music|~|Concerts|~|Choirs (Music),Saint James (Barbados),20th century,
Work,Evening of Christmas Music by Payne's Bay Methodist Church Choir,ark:/21198/z1cr7mdc,ark:/21198/z1rf7n15,afddsf/barb_eph_cch0104.pdf,,Ephemera Collection,,"December 19, 1993",1993-12-19,13.1939,59.5432,"Program of an evening of Christmas music presented by the Payne's Bay Methodist Church Choir featuring the Holetown Harmonites Steel Orchestra on December 19, 1993.",21.6 cm x 14 cm,3 pages,,programs (documents)|~|concert programs,,,Payne's Bay Methodist Church,,,Barbados,,Barbados Department of Archives,text,public domain,Barbados Department of Archives,,Church|~|Christmas music|~|Arts and culture -- Music|~|Concerts|~|Choirs (Music)|~|Steel band music,Saint James (Barbados),20th century,
Work,Festival Recital at St. George's Parish Church,ark:/21198/z1806vpz,ark:/21198/z1rf7n15,afddsf/barb_eph_cch0105.pdf,,Ephemera Collection,,"May 8, 1960",1960-05-08,13.1939,59.5432,"Program for the festival recital held at St. George's Parish Church on May 8, 1960. Proceeds in aid of choir funds.",21.5 cm x 14.4 cm,3 pages,,programs (documents)|~|concert programs,,,St. George's Parish Church,,,Barbados,,Barbados Department of Archives,text,public domain,Barbados Department of Archives,,Church|~|Arts and culture -- Music|~|Concerts,Saint George (Barbados),20th century,
Work,Evening of Music at St. Philip's Parish Church,ark:/21198/z14763x5,ark:/21198/z1rf7n15,afddsf/barb_eph_cch0106.pdf,,Ephemera Collection,,"August 28, 1960",1960-08-28,13.1939,59.5432,"Program for an evening of music held at St. Philip's Parish Church on August 28, 1960 in aid of choir funds.",21.6 cm x 16.4 cm,2 pages,,programs (documents)|~|concert programs,,,St. Philip's Parish Church,,,Barbados,,Barbados Department of Archives,text,public domain,Barbados Department of Archives,,Church|~|Arts and culture -- Music|~|Concerts|~|Choirs (Music),Saint Philip (Barbados),20th century,
Work,Programme of Recital at St. Michael's Cathedral,ark:/21198/z10k42m5,ark:/21198/z1rf7n15,afddsf/barb_eph_cch0107.pdf,,Ephemera Collection,,"October 6, 1960",1960-10-06,13.1939,59.5432,"Program for a music and song recital held at St. Michael's Cathedral on October 6, 1960. Soloists: Doris Provencal, Arnold Morralee, Gerald Hudson, Joan Burrowes, Neville King, and the Cathedral Choir.",21.6 cm x 16.6 cm,2 pages,,programs (documents)|~|concert programs,,,St. Michael's Cathedral Church,,,Barbados,,Barbados Department of Archives,text,public domain,Barbados Department of Archives,,Church|~|Arts and culture -- Music|~|Concerts|~|Choirs (Music),Saint Michael (Barbados),20th century,
Work,Recital of Sacred Music at St. Mary's Church,ark:/21198/z1vt3k3f,ark:/21198/z1rf7n15,afddsf/barb_eph_cch0108.pdf,,Ephemera Collection,,"July 13, 1961",1961-07-13,13.1939,59.5432,"Program for a recital of sacred music by the St. Mary's Augmented Choir with organist and director Bentley Callender, and soloists Doris Provencal (Soprano), Ernest Rocheford (Baritone), Prince Cave (Clarionet) and Merton McCarthy (Organ). The recital was held at St. Mary's Church on July 13, 1961.",20.9 cm x 16.7 cm,6 pages,,programs (documents)|~|concert programs,,,St. Mary's Church,,,Barbados,,Barbados Department of Archives,text,public domain,Barbados Department of Archives,,Church|~|Arts and culture -- Music|~|Concerts|~|Choirs (Music)|~|Organ (Musical instrument),Saint Michael (Barbados),20th century,
Work,Recital of Music at St. Mary's Church,ark:/21198/z1r22tc1,ark:/21198/z1rf7n15,afddsf/barb_eph_cch0109.pdf,,Ephemera Collection,,"June 3, 1965",1965-06-03,13.1939,59.5432,"Program of music by the St. Mary's Church Choir under the direction of Lieut. W. C. Greasley of the Royal Barbados Police Force, held at the St. Mary's Church on June 3, 1965. Proceeds in aid of the choir's proposed tour of Dominica.",21.6 cm x 16.4 cm,2 pages,,programs (documents)|~|concert programs,,,St. Mary's Church,,,Barbados,,Barbados Department of Archives,text,public domain,Barbados Department of Archives,,Church|~|Arts and culture -- Music|~|Concerts|~|Police,Saint Michael (Barbados),20th century,
Work,Recital of Sacred & Classical Music at St. Mary's Church,ark:/21198/z1m922np,ark:/21198/z1rf7n15,afddsf/barb_eph_cch0110.pdf,,Ephemera Collection,,"June 18, 1967",1967-06-18,13.1939,59.5432,"Program for the recital of sacred and classical music by the Augmented Choir of St. Mary's Church and soloists. Proceeds in aid of St. Mary's choir tour of Montserrat during August 1967. The event was held at St. Mary's Church on June 18, 1967.",21.5 cm x 16.4 cm,2 pages,,programs (documents)|~|concert programs,,,St. Mary's Church,,,Barbados,,Barbados Department of Archives,text,public domain,Barbados Department of Archives,,Church|~|Arts and culture -- Music|~|Concerts|~|Choirs (Music),Saint Michael (Barbados),20th century,
Work,Recital of Missa Papae Marcelli (Palestrina) and Magnificat  in D (J. S. Bach),ark:/21198/z1gj1b08,ark:/21198/z1rf7n15,afddsf/barb_eph_cch0111.pdf,,Ephemera Collection,,"April 27, 1967",1967-04-27,13.1939,59.5432,"Program for recital by the Sine Nomine Singers presenting Palestrina's Missa Papae Marcelli and Bach's Magnificat in D. The recital was held at the Christ Church parish church on April 27, 1967.",21.6 cm x 16.4 cm,8 pages,,programs (documents)|~|concert programs,,,Sine Nomine Singers,,,Barbados,,Barbados Department of Archives,text,public domain,Barbados Department of Archives,,Church|~|Arts and culture -- Music|~|Concerts|~|Choirs (Music),Christ Church (Barbados),20th century,
Work,Music Concert at St. Mary's Church,ark:/21198/z1bs0k6n,ark:/21198/z1rf7n15,afddsf/barb_eph_cch0112.pdf,,Ephemera Collection,,"March 28, 1968",1968-03-28,13.1939,59.5432,"Music recital by the Sine Nomine Singers presenting Minor Mass (R. V. Williams), Jesus and the Traders (Z. Kodaly) and Sing Ye to the Lord (J. S. Bach). The recital was held at St. Mary's Church on March 28, 1968.",21.6 cm x 13.9 cm,7 pages,,programs (documents)|~|concert programs,,,Sine Nomine Singers,,,Barbados,,Barbados Department of Archives,text,public domain,Barbados Department of Archives,,Church|~|Arts and culture -- Music|~|Concerts|~|Choirs (Music),Saint Michael (Barbados),20th century,
Work,Annual Recital of Sacred Music at Christ Church Parish Church,ark:/21198/z1709tgp,ark:/21198/z1rf7n15,afddsf/barb_eph_cch0113.pdf,,Ephemera Collection,,"October 19, 1969",1969-10-19,13.1939,59.5432,"Annual recital of sacred music held at the Christ Church Parish Church on October 19, 1969 with guest soloists Eve Johnson (Soprano), Chris Headley (Violin) and Ernest Rocheford (Bass).",17.8 cm x 10.7 cm,3 pages,,programs (documents)|~|concert programs,,,Christ Church Parish Church,,,Barbados,,Barbados Department of Archives,text,public domain,Barbados Department of Archives,,Church|~|Arts and culture -- Music|~|Concerts,Christ Church (Barbados),20th century,
Work,Music Recital by the Sine Nomine Singers,ark:/21198/z13b7s64,ark:/21198/z1rf7n15,afddsf/barb_eph_cch0114.pdf,,Ephemera Collection,,"March 25, 1970",1970-03-25,13.1939,59.5432,"Music recital by the Sine Nomine Singers presenting Palestrina's Stabat Mater and Mozart's Requiem with soloists Alpha Humphries (Soprano), Doris Provencal (Contralto), David Mettee (Tenor), and Lloyd Brooks (Bass). The event was held at St. Michael's Cathedral on March 25, 1970 in aid of the St. Michael's Cathedral Choir Fund.",21.6 cm x 14 cm,8 pages,,programs (documents)|~|concert programs,,,Sine Nomine Singers,,,Barbados,,Barbados Department of Archives,text,public domain,Barbados Department of Archives,,Church|~|Arts and culture -- Music|~|Concerts|~|Choirs (Music),Saint Michael (Barbados),20th century,
Work,The Crucifixion: Concert by the Augmented Bethel Church Choir,ark:/21198/z1zk78qt,ark:/21198/z1rf7n15,afddsf/barb_eph_cch0115.pdf,,Ephemera Collection,,"March 26, 1975",1975-03-26,13.1939,59.5432,"Concert by the Augmented Bethel Church Choir presenting the Crucifixion (J. Stainer), held at Bethel Church on March 26, 1975. Organist: Doris Arthur. Soloists: Seymour Clarke and Vernon Clarke (Tenors), Vincent Brathwaite (Baritone), and Trent Hinkson (Bass).",21.6 cm x 15.8 cm,7 pages,,programs (documents)|~|concert programs,,,Bethel Church,,,Barbados,,Barbados Department of Archives,text,public domain,Barbados Department of Archives,,Church|~|Arts and culture -- Music|~|Concerts|~|Choirs (Music)|~|Organ (Musical instrument),Saint Michael (Barbados),20th century,
