Object Type,Title,Item ARK,Parent ARK,File Name,AltTitle.other,collection.physical,Contents note,Date.created,Date.normalized,Description.latitude,Description.longitude,Description.note,Format.dimensions,Format.extent,Format.medium,Genre,Language,Local identifier,Name.creator,Named subject,Note,Place of origin,Publisher.publisherName,Repository,Resource type,Rights.copyrightStatus,Rights.rightsHolderContact,Statement of Responsibility,Subject,Subject geographic,Subject temporal,Creator
Work,Service for the Official Funeral of Lady Adams,ark:/21198/z1515r7x,ark:/21198/z1rf7n15,afddsf/barb_eph_def0092.pdf,,Ephemera Collection,,"March 10, 1990",1990-03-10,13.1939,59.5432,"Booklet for the funeral service of Lady Adams (1904-1990), held at the St. Michael's Cathedral on March 10, 1990, 4:00 pm. Lady Grace Adams was the wife of Barbados' first Premier Sir Grantley Adams and the mother of Barbados' second Prime Minister, J.MG.M. ""Tom"" Adams.",14.5 x 21 cm,15 pages,,Program booklets|~|Memorial service programs,,,Government of Barbados,,,Barbados,,Barbados Department of Archives,text,public domain,Barbados Department of Archives,,Funerals|~|Funeral service,Saint Michael (Barbados),20th Century,
Work,Solemn Requiem Eucharist for Oliver Carrington Haynes,ark:/21198/z11850j1,ark:/21198/z1rf7n15,afddsf/barb_eph_def0093.pdf,,Ephemera Collection,,November 1990,1990-11,13.1939,59.5432,"Booklet for the funeral service of Oliver Carrington Haynes late of ""Coverly"" Bank Hall Cross Road, St. Michael, held at the Church of St. Barnabas, St. Barnabas Road, St. Michael, on Saturday, November 10, 1990.",20.5 x 29.5 cm,20 pages,,Program booklets|~|Memorial service programs,,,St. Barnabas Church,,,Barbados,,Barbados Department of Archives,text,public domain,Barbados Department of Archives,,Funerals|~|Funeral service,Saint Michael (Barbados),20th Century,
Work,Service for the Official Funeral of Lady Ward,ark:/21198/z1wh4h36,ark:/21198/z1rf7n15,afddsf/barb_eph_def0094.pdf,,Ephemera Collection,,"August 1, 1991",1991-08-01,13.1939,59.5432,"Booklet for the funeral service of Lady Ward (1916-1991), held at the St. Michael's Cathedral on August 1, 1991 at 5:00 pm.",14 x 22 cm,18 pages,,Program booklets|~|Memorial service programs,,,Government of Barbados,,,Barbados,,Barbados Department of Archives,text,public domain,Barbados Department of Archives,,Funerals|~|Funeral service,Saint Michael (Barbados),20th Century,
Work,"Guide to The Procedures for the State Funeral of the Late Governor-General Her Excellency Dame Nita Barrow, GCMG, DA",ark:/21198/z1rr3r9k,ark:/21198/z1rf7n15,afddsf/barb_eph_def0095.pdf,,Ephemera Collection,,"December 29, 1995",1995-12-29,13.1939,59.5432,"Booklet-guide to procedures for the lying in state, funeral procession and state funeral of Dame Nita Barrow. Her Excellency Dame Nita Barrow was the Dame Grand Cross of the Most Distinguished Order of Saint Michael and Saint George, Dame of St. Andrew. She was the sister of former Prime Minister Errol Walton Barrow. Dame Nita was appointed in 1990 as Barbados’ first female governor general. In that post, she served as Queen Elizabeth II’s representative to this former British colony. Dame Nita was seventy-nine years old (1916-1995) and served as Governor General for five years (1990-1995). The funeral service was held at the James Street Methodist Church at 10:00 am.",14.5 x 21 cm,9 pages,,Program booklets|~|Memorial service programs,,,Government of Barbados,,,Barbados,,Barbados Department of Archives,text,public domain,Barbados Department of Archives,,Funerals|~|Funeral service,Saint Michael (Barbados),20th Century,
Work,"Service for The State Funeral: Dame Ruth Nita Barrow GCMG, DA",ark:/21198/z1n31q0w,ark:/21198/z1rf7n15,afddsf/barb_eph_def0096.pdf,,Ephemera Collection,,"December 29, 1995",1995-12-29,13.1939,59.5432,"Her Excellency Dame Nita Barrow was the Dame Grand Cross of the Most Distinguished Order of Saint Michael and Saint George, Dame of St. Andrew. She was the sister of former Prime Minister, Errol Walton Barrow. Dame Nita was appointed in 1990 as Barbados’ first female governor general. In that post, she served as Queen Elizabeth II’s representative to this former British colony. Dame Nita was seventy-nine years old (1916-1995) and served as Governor General for five years (1990-1995). The funeral service was held at the James Street Methodist Church on December 29, 1995, at 10:00 am.

",14.5 x 20.5 cm,9 pages,,Program booklets|~|Memorial service programs,,,Government of Barbados,,,Barbados,,Barbados Department of Archives,text,public domain,Barbados Department of Archives,,Funerals|~|Funeral service,Saint Michael (Barbados),20th Century,
Work,The Funeral Service of Elsie Viola Haynes,ark:/21198/z1hb0z7q,ark:/21198/z1rf7n15,afddsf/barb_eph_def0097.pdf,,Ephemera Collection,,"June 27, 1997",1997-06-27,13.1939,59.5432,"Funeral service for Elsie Viola Haynes late of ""Dulce Dorum"" Belle Gully, St. Michael, held at St. Barnabas Anglican Church on June 27, 1997, at 4:45 pm.",14 x 22 cm,13 pages,,Program booklets|~|Memorial service programs,,,,,,Barbados,,Barbados Department of Archives,text,public domain,Barbados Department of Archives,,Funerals|~|Funeral service,Saint Michael (Barbados),20th Century,
Work,Service of Praise and Thanksgiving for the Life of Herbert Piercy Ward,ark:/21198/z1ck06gx,ark:/21198/z1rf7n15,afddsf/barb_eph_def0098.pdf,,Ephemera Collection,,"July 18, 1997",1997-07-18,13.1939,59.5432,"Booklet for the funeral service of Herbert Piercy Ward, late of No. 1, Barclay's Terrace, Wildey, St. Michael, held at Hawthorn Methodist Church on Jul 18, 1997, at 3:00 pm.",14 x 22 cm,12 pages,,Program booklets|~|Memorial service programs,,,,,,Barbados,,Barbados Department of Archives,text,public domain,Barbados Department of Archives,,Funerals|~|Funeral service,Christ Church (Barbados),20th Century,
Work,A Service of Thanksgiving for the life of Mildred Delores Adams,ark:/21198/z17s9frn,ark:/21198/z1rf7n15,afddsf/barb_eph_def0099.pdf,,Ephemera Collection,,"August 27, 1997",1997-08-27,13.1939,59.5432,"Booklet for the funeral service of Mildred Delores Adams, late of River Road, St. Michael, held at the St. Patrick's Roman Catholic Cathedral, Jemmot's Lane, St. Michael, on August 27, 1997, at 3:00 pm .",14 x 22 cm,12 pages,,Program booklets|~|Memorial service programs,,,,,,Barbados,,Barbados Department of Archives,text,public domain,Barbados Department of Archives,,Funerals|~|Funeral service,Saint Michael (Barbados),20th Century,
Work,A Service of Thanksgiving for the Life of The Rev. Errol C. Wiltshire,ark:/21198/z1418q3j,ark:/21198/z1rf7n15,afddsf/barb_eph_def0100.pdf,,Ephemera Collection,,"October 22, 1997",1997-10-22,13.1939,59.5432,"Booklet for the funeral service of Rev. Errol C. Wiltshire on Wednesday, Oct 22, 1997, held at the St. Mary's Church at 4:00 p.m.",14 x 22 cm,18 pages,,Program booklets|~|Memorial service programs,,,,,,Barbados,,Barbados Department of Archives,text,public domain,Barbados Department of Archives,,Funerals|~|Funeral service,Saint Michael (Barbados),20th Century,
Work,A Farewell Service: Monica Agnes Skeete,ark:/21198/z1087zct,ark:/21198/z1rf7n15,afddsf/barb_eph_def0101.pdf,,Ephemera Collection,,"January 2, 1998",1998-01-02,13.1939,59.5432,"Booklet for the funeral service of Monica Agnes Skeete, late of #71 Atlantic Shores, Christ Church, held at the Chapel of St. James Cemetery on January 2, 1998, at 3:00pm.",14 x 22 cm,4 pages,,Program booklets|~|Memorial service programs,,,,,,Barbados,,Barbados Department of Archives,text,public domain,Barbados Department of Archives,,Funerals|~|Funeral service,Saint James (Barbados),20th Century,
Work,In Loving Memory: Samuel Timothy Gibbs,ark:/21198/z1vh7fxz,ark:/21198/z1rf7n15,afddsf/barb_eph_def0102.pdf,,Ephemera Collection,,"February 3, 1998",1998-02-03,13.1939,59.5432,"Booklet for the funeral service of Samuel Timothy Gibbs, late of Literary Row, Bridgetown, held at St. Mary's Anglican Church on February 3, 1998, at 9:30 am.",14 x 22 cm,12 pages,,Program booklets|~|Memorial service programs,,,,,,Barbados,,Barbados Department of Archives,text,public domain,Barbados Department of Archives,,Funerals|~|Funeral service,Saint Michael (Barbados),20th Century,
Work,Thanksgiving Service: Fitz Harold Cummins,ark:/21198/z1qv5dmz,ark:/21198/z1rf7n15,afddsf/barb_eph_def0103.pdf,,Ephemera Collection,,"February 7, 1998",1998-02-07,13.1939,59.5432,"Booklet for the funeral service of Fitz Harold Cummins, late of Jackman, St. Michael, held at St. Matthew's Church on February 7, 1998, at 3:30pm.",14 x 22 cm,13 pages,,Program booklets|~|Memorial service programs,,,,,,Barbados,,Barbados Department of Archives,text,public domain,Barbados Department of Archives,,Funerals|~|Funeral service,Saint Michael (Barbados),20th Century,
Work,Service of Thanksgiving: Helga Onetha Jones,ark:/21198/z1m34ntn,ark:/21198/z1rf7n15,afddsf/barb_eph_def0104.pdf,,Ephemera Collection,,"March 2, 1998",1998-03-02,13.1939,59.5432,"Booklet for the funeral service of Helga Onetha Jones (Baby), late of Skeets Road, The Ivy, St. Michael, held at the Church of St. Barnabas on March 2, 1998, at 4:30 pm.",14 x 22 cm,10 pages,,Program booklets|~|Memorial service programs,,,,,,Barbados,,Barbados Department of Archives,text,public domain,Barbados Department of Archives,,Funerals|~|Funeral service,Saint Michael (Barbados),20th Century,
Work,A Service of Thanksgiving: Tanya Michelle Maynard,ark:/21198/z1gb3x2w,ark:/21198/z1rf7n15,afddsf/barb_eph_def0105.pdf,,Ephemera Collection,,"May 29, 1998",1998-05-29,13.1939,59.5432,"Booklet for the funeral service of Tanya Michelle Maynard, held at James Street Methodist Church, Bridgetown, on May 29, 1998, at 4:00 pm.",14 x 22 cm,8 pages,,Program booklets|~|Memorial service programs,,,,,,Barbados,,Barbados Department of Archives,text,public domain,Barbados Department of Archives,,Funerals|~|Funeral service,Saint Michael (Barbados),20th Century,
Work,A Service of Thanksgiving: Deighton Harcourt Lisle Alleyne,ark:/21198/z1bk35c0,ark:/21198/z1rf7n15,afddsf/barb_eph_def0106.pdf,,Ephemera Collection,,"August 11, 1998",1998-04-11,13.1939,59.5432,"Booklet for the funeral service of Deighton Harcourt Lisle Alleyne, late of ""Pamcourt"" #58 Ocean City 'B' St. Philip, held at St. Matthias Anglican Church on August 11, 1998, 2:30 pm.",14 x 22 cm,14 pages,,Program booklets|~|Memorial service programs,,,,,,Barbados,,Barbados Department of Archives,text,public domain,Barbados Department of Archives,,Funerals|~|Funeral service,Christ Church (Barbados),20th Century,
Work,A Service of Thanksgiving: Enid Kathleen Williams,ark:/21198/z16t2dq5,ark:/21198/z1rf7n15,afddsf/barb_eph_def0107.pdf,,Ephemera Collection,,"September 26, 1998",1998-09-26,13.1939,59.5432,"Booklet for the funeral service of Enid Kathleen Williams, late of Enterprise Coast Road, Christ Church, held at St. Michael's Cathedral on September 26, 1998, 4:00 pm.",14 x 22 cm,12 pages,,Program booklets|~|Memorial service programs,,,,,,Barbados,,Barbados Department of Archives,text,public domain,Barbados Department of Archives,,Funerals|~|Funeral service,Saint Michael (Barbados),20th Century,
Work,Service of Thanksgiving: Cecil Beaumont Williams,ark:/21198/z1321p05,ark:/21198/z1rf7n15,afddsf/barb_eph_def0108.pdf,,Ephemera Collection,,"September 30, 1998",1998-09-30,13.1939,59.5432,"Booklet for the funeral service of Cecil Beaumont Williams, late of ""Moonshine Hall"", St. George, held at James Street Methodist Church, St. Michael, on September 30, 1998, at 4:30 pm.",14 x 22 cm,12 pages,,Program booklets|~|Memorial service programs,,,,,,Barbados,,Barbados Department of Archives,text,public domain,Barbados Department of Archives,,Funerals|~|Funeral service,Saint Michael (Barbados),20th Century,
Work,"Celebration of Life: Keith Alwyn Roach, SCM",ark:/21198/z1zc9vzp,ark:/21198/z1rf7n15,afddsf/barb_eph_def0109.pdf,,Ephemera Collection,,"February 12, 1999",1999-02-12,13.1939,59.5432,"Booklet for the funeral service of Keith Alwyn Roach, SCM, held at St. Mary's Church on February 12, 1999, 2:30 pm.",12 x 23 cm,24 pages,,Program booklets|~|Memorial service programs,,,,,,Barbados,,Barbados Department of Archives,text,public domain,Barbados Department of Archives,,Funerals|~|Funeral service,Saint Michael (Barbados),20th Century,
Work,"Guide to the Procedures for the State Funeral of the Late Right Excellent Sir Frank Walcott KA, OBE",ark:/21198/z1tm9469,ark:/21198/z1rf7n15,afddsf/barb_eph_def0110.pdf,,Ephemera Collection,,"March 8, 1999",1999-03-08,13.1939,59.5432,"Guide to procedures for the lying in state, funeral procession, state funeral and the burial of Sir Frank Walcott. Sir Frank Walcott was a Barbadian trade unionist, politician and ambassador. He played a major role in organizing the Babados labor movement and stimulated participation in the nation's political process.",14 x 22 cm,9 pages,,Program booklets|~|Memorial service programs,,,Government of Barbados,,,Barbados,,Barbados Department of Archives,text,public domain,Barbados Department of Archives,,Funerals|~|Funeral service,Saint Michael (Barbados),20th Century,
Work,"Service for The State Funeral of the Late Right Excellent Sir Frank Walcott KA, OBE",ark:/21198/z1pv8cf4,ark:/21198/z1rf7n15,afddsf/barb_eph_def0111.pdf,,Ephemera Collection,,"March 8, 1999",1999-03-08,13.1939,59.5432,"Booklet for the funeral service of Sir Walcott (1916-1999). The funeral was held at St. Michael's Cathedral on March 8, 1999, at 2:30 pm. Sir Frank Walcott was a Barbadian trade unionist, politician and ambassador. He played a major role in organizing the Babados labor movement and stimulated participation in the nation's political process.",14 x 22 cm,15 pages,,Program booklets|~|Memorial service programs,,,Government of Barbados,,,Barbados,,Barbados Department of Archives,text,public domain,Barbados Department of Archives,,Funerals|~|Funeral service,Saint Michael (Barbados),20th Century,
Work,"Service on the Occasion of the Interment of the Late Right Excellent Sir Frank Walcott KA, OBE",ark:/21198/z1k37mp8,ark:/21198/z1rf7n15,afddsf/barb_eph_def0112.pdf,,Ephemera Collection,,"March 8, 1999",1999-03-08,13.1939,59.5432,"Booklet for the interment of Sir Frank Walcott that was held at the Westbury Cemetery, Westbury, St. Michael on March 8, 1999.",14 x 22 cm,7 pages,,Program booklets|~|Memorial service programs,,,,,,Barbados,,Barbados Department of Archives,text,public domain,Barbados Department of Archives,,Burial|~|Burial service|~|Interment,Saint Michael (Barbados),20th Century,
Work,Service of Thanksgiving: Meta Williams,ark:/21198/z1fb6w0d,ark:/21198/z1rf7n15,afddsf/barb_eph_def0113.pdf,,Ephemera Collection,,"March 13, 1999",1999-03-13,13.1939,59.5432,"Booklet for the funeral service of Meta Williams, late of Upper Carlton, St. James, held at the Salvation Army Corp. Upper Carlton, St. James, on March 13, 1999, at 2:30 pm.",14 x 22 cm,8 pages,,Program booklets|~|Memorial service programs,,,,,,Barbados,,Barbados Department of Archives,text,public domain,Barbados Department of Archives,,Funerals|~|Funeral service,Saint James (Barbados),20th Century,
Work,"Funeral of Father Peter Raphael Gallagher, O.P.",ark:/21198/z19k649h,ark:/21198/z1rf7n15,afddsf/barb_eph_def0114.pdf,,Ephemera Collection,,"June 3, 1999",1999-06-03,13.1939,59.5432,"Booklet for the funeral service of Father Peter Raphael Gallagher, Parish Priest of St. Dominic's Church, Maxwell, Chrich Church & Catholic Chaplain to the Queen Elizabeth Hospital. The service was held at the St. Patrick's Cathedral on June 3, 1999, at 4:00 pm.",14 x 22 cm,11 pages,,Program booklets|~|Memorial service programs,,,,,,Barbados,,Barbados Department of Archives,text,public domain,Barbados Department of Archives,,Funerals|~|Funeral service,Saint Michael (Barbados),20th Century,
Work,Service of Thanksgiving: Cephas Leroy Parris,ark:/21198/z15t5cm7,ark:/21198/z1rf7n15,afddsf/barb_eph_def0115.pdf,,Ephemera Collection,,"December 20, 1999",1999-12-20,13.1939,59.5432,"Booklet for the funeral service of Cephas Leroy Parris, late of Lot 11 Bridge Cot Terrace, St. George, held at St. John's Parish Church on December 20, 1999, at 4:00 pm.",14 x 22 cm,12 pages,,Program booklets|~|Memorial service programs,,,,,,Barbados,,Barbados Department of Archives,text,public domain,Barbados Department of Archives,,Funerals|~|Funeral service,St. John (Barbados),20th Century,
Work,Service of Thanksgiving: Hutson Athill Williams,ark:/21198/z1253b83,ark:/21198/z1rf7n15,afddsf/barb_eph_def0116.pdf,,Ephemera Collection,,"January 29, 2000",2000-01-29,13.1939,59.5432,"Booklet for the funeral service of Hutson Athill Williams, late of  Enterprise Coast Road, Christ Church, held at St. Michael's Cathedral on January 29, 2000, at 4:00 pm.",14 x 22 cm,12 pages,,Program booklets|~|Memorial service programs,,,,,,Barbados,,Barbados Department of Archives,text,public domain,Barbados Department of Archives,,Funerals|~|Funeral service,Saint Michael (Barbados),21st Century,
Work,A Service of Thanksgiving: William DeCourcey Jeffers,ark:/21198/z1xd2trz,ark:/21198/z1rf7n15,afddsf/barb_eph_def0117.pdf,,Ephemera Collection,,"April 10, 2000",2000-04-10,13.1939,59.5432,"Booklet for the funeral service of William DeCoursey Jeffers, late of ""Shalimar"" #9 Neils, St. Michael, held at St. Matthias Church on April 10, 2000, at 3:00 pm.",14 x 22 cm,14 pages,,Program booklets|~|Memorial service programs,,,,,,Barbados,,Barbados Department of Archives,text,public domain,Barbados Department of Archives,,Funerals|~|Funeral service,Christ Church (Barbados),21st Century,
Work,A Service of Thanksgiving for the Life of Kathleen Cameron Hawkins,ark:/21198/z1sn2311,ark:/21198/z1rf7n15,afddsf/barb_eph_def0118.pdf,,Ephemera Collection,,"May 19, 2000",2000-05-19,13.1939,59.5432,"Booklet for the funeral service of Kathleen Cameron Hawkins, late of Egerton, St. George, held at St. Luke's Church, St. George on May 19, 2000.",14 x 22 cm,7 pages,,Program booklets|~|Memorial service programs,,,,,,Barbados,,Barbados Department of Archives,text,public domain,Barbados Department of Archives,,Funerals|~|Funeral service,Saint George (Barbados),21st Century,
Work,A Going Home Service for John Clemensford Wilsden Wickham,ark:/21198/z1nw1b8v,ark:/21198/z1rf7n15,afddsf/barb_eph_def0119.pdf,,Ephemera Collection,,"September 5, 2000",2000-09-05,13.1939,59.5432,"Booklet for the funeral service of John Clemensford Wilsden Wickham, late of ""Ferney"", Atlantic Shores, Christ Church, held at Christ Church Parish Church, on September 5, 2000, at 2:00 pm.",14 x 22 cm,12 pages,,Program booklets|~|Memorial service programs,,,,,,Barbados,,Barbados Department of Archives,text,public domain,Barbados Department of Archives,,Funerals|~|Funeral service,Christ Church (Barbados),21st Century,
Work,Let Us Give Thanks to God for the Life of John Cyril Payne,ark:/21198/z1j40kkw,ark:/21198/z1rf7n15,afddsf/barb_eph_def0120.pdf,,Ephemera Collection,,"September 14, 2000",2000-09-14,13.1939,59.5432,"Booklet for the funeral service of John Cyril Payne, late of Harrow Plantation, St. Philip, held on September 14, 2000, at 4:30 pm.",14 x 22 cm,12 pages,,Program booklets|~|Memorial service programs,,,,,,Barbados,,Barbados Department of Archives,text,public domain,Barbados Department of Archives,,Funerals|~|Funeral service,Saint Philip (Barbados),21st Century,
Work,Let Us Give Thanks to God for the Life of Myrna Wharton,ark:/21198/z1db9txh,ark:/21198/z1rf7n15,afddsf/barb_eph_def0121.pdf,,Ephemera Collection,,"December 8, 2000",2000-12-08,13.1939,59.5432,"Booklet for the funeral service of Myrna Wharton, late of No. 8 Gibbons Brow, Christ Church, held at St. Patrick's Roman Catholic Cathedral, Jemmotts Lane, on December 8, 2000, at 2:30 pm.",14 x 22 cm,13 pages,,Program booklets|~|Memorial service programs,,,,,,Barbados,,Barbados Department of Archives,text,public domain,Barbados Department of Archives,,Funerals|~|Funeral service,Saint Michael (Barbados),21st Century,
Work,Service of Thanksgiving for the Life of Fitz-Roy Decourcey Gill,ark:/21198/z18k9354,ark:/21198/z1rf7n15,afddsf/barb_eph_def0122.pdf,,Ephemera Collection,,"March 17, 2001",2001-03-17,13.1939,59.5432,"Booklet for the funeral service of Fitz-Roy Decourcey Gill, late of Roaches Plantation, St. Lucy, held at St. Lucy's Parish Church on March 17, 2001, at 9:30 pm.",14 x 22 cm,9 pages,,Program booklets|~|Memorial service programs,,,,,,Barbados,,Barbados Department of Archives,text,public domain,Barbados Department of Archives,,Funerals|~|Funeral service,Saint Lucy (Barbados),21st Century,
Work,A Service of Thanksgiving for the Life and Witness of Viola Springer,ark:/21198/z14x71vq,ark:/21198/z1rf7n15,afddsf/barb_eph_def0123.pdf,,Ephemera Collection,,"June 9, 2001",2001-06-09,13.1939,59.5432,"Booklet for the funeral service of Viola Springer ""Mrs. White"", aged 100 years old, late of 2nd Browe's Ave., St. Michael and formerly of Hillaby, St. Andrew, held at the Ebenezer New Covenant Pentecostal, White Hill, St. Andrew, on June 9, 2001, at 1:30 pm.",14 x 22 cm,12 pages,,Program booklets|~|Memorial service programs,,,,,,Barbados,,Barbados Department of Archives,text,public domain,Barbados Department of Archives,,Funerals|~|Funeral service,Saint Andrew (Barbados),21st Century,
Work,Funeral Service for Evelyn Helena Williams,ark:/21198/z115694q,ark:/21198/z1rf7n15,afddsf/barb_eph_def0124.pdf,,Ephemera Collection,,"July 9, 2001",2001-07-09,13.1939,59.5432,"Booklet for the funeral service of Evelyn Helena Williams, late of Enterprise Coast Road, Christ Church, held at Bethlehem Moravian Church, Maxwell, Christ Church, on July 9, 2001, at 2:30 pm.",14 x 22 cm,12 pages,,Program booklets|~|Memorial service programs,,,,,,Barbados,,Barbados Department of Archives,text,public domain,Barbados Department of Archives,,Funerals|~|Funeral service,Christ Church (Barbados),21st Century,
Work,A Service of Thanksgiving for the Life of Ermine Jeannette Clarke,ark:/21198/z1wd5sk4,ark:/21198/z1rf7n15,afddsf/barb_eph_def0125.pdf,,Ephemera Collection,,"May 30, 2002",2002-05-30,13.1939,59.5432,"Booklet for the funeral service of Ermine Jeannette Clarke, late of 38 Regency Park, Christ Church, held at James Street Methodist Church at 2:30 p.m. on Thursday, May 30, 2002.",14 x 22 cm,17 pages,,Program booklets|~|Memorial service programs,,,,,,Barbados,,Barbados Department of Archives,text,public domain,Barbados Department of Archives,,Funerals|~|Funeral service,Saint Michael (Barbados),21st Century,
Work,A Service of Praise and Thanksgiving for the Life of Ferris Handel Cummins,ark:/21198/z1rn51vs,ark:/21198/z1rf7n15,afddsf/barb_eph_def0126.pdf,,Ephemera Collection,,"July 12, 2002",2002-07-12,13.1939,59.5432,"Booklet for the funeral service of Ferris Handel Cummins, late of 112 Lodge Terrace, St. Michael, held on Friday, July 12, 2002 at the James Street Methodist Church.",14 x 22 cm,17 pages,,Program booklets|~|Memorial service programs,,,,,,Barbados,,Barbados Department of Archives,text,public domain,Barbados Department of Archives,,Funerals|~|Funeral service,Saint Michael (Barbados),21st Century,
Work,The Funeral Service of Gladstone Albert Holder,ark:/21198/z1mw495x,ark:/21198/z1rf7n15,afddsf/barb_eph_def0127.pdf,,Ephemera Collection,,"August 13, 2002",2002-08-13,13.1939,59.5432,"Booklet for the funeral service of Gladstone Albert Holder held at the James Street Methodist Church, Bridgetown, on Tuesday, August 13, 2002 at 2:00 p.m. Gladstone Holder was a long-serving columnist for the widely-read Nation newspaper.",14 x 22 cm,26 pages,,Program booklets|~|Memorial service programs,,,,,,Barbados,,Barbados Department of Archives,text,public domain,Barbados Department of Archives,,Funerals|~|Funeral service,Saint Michael (Barbados),21st Century,
Work,Lovingly Remembered : Percy O'Neale Small,ark:/21198/z1h43jhd,ark:/21198/z1rf7n15,afddsf/barb_eph_def0128.pdf,,Ephemera Collection,,"November 1, 2002",2002-11-01,13.1939,59.5432,"Booklet for the funeral service of Percy O'Neale Small, late of 11 Mansion Place, Bayville, St. Michael, held on Friday, November 1, 2002 at St. Paul's Church at 2:30 p.m.  Officiating was The Rev. Canon Wayne Issacs. The interment was held at the churchyard of St. Andrew's Parish Church and officiating was The Rev. Edward Eatherer.",14 x 22 cm,16 pages,,Program booklets|~|Memorial service programs,,,,,,Barbados,,Barbados Department of Archives,text,public domain,Barbados Department of Archives,,Funerals|~|Funeral service,Saint Michael (Barbados)|~|Saint Andrew (Barbados),21st Century,
Work,A Memorial Service for Una Thelma Philomene St. Jour,ark:/21198/z1cc2ssp,ark:/21198/z1rf7n15,afddsf/barb_eph_def0129.pdf,,Ephemera Collection,,"December 20, 2002",2002-12-20,13.1939,59.5432,"Booklet for the funeral service of Una Thelma Philomene St. Jour, late of ''Lucite'' Maxwell Coast Road, Christ Church, held on Friday, December 20, 2002 at 4:00 p.m at St. Patrick Roman Catholic Cathedral.",14 x 22 cm,7 pages,,Program booklets|~|Memorial service programs,,,,,,Barbados,,Barbados Department of Archives,text,public domain,Barbados Department of Archives,,Funerals|~|Funeral service,Saint Michael (Barbados),21st Century,
Work,A Service of Thanksgiving for the Life of Eirene Augustine Gollop,ark:/21198/z17q0rh4,ark:/21198/z1rf7n15,afddsf/barb_eph_def0130.pdf,,Ephemera Collection,,February 2003,2003-02,13.1939,59.5432,"Booklet for the funeral service of Eirene Augustine Gollop, late of President Kennedy Drive, St. Michael on Saturday, February 1, 2003, held at the St. Mary's Anglican Church.  Officiating was the Rev. Canon Frank Marshall, and the interment was held at the Westbury Cemetery.",14 x 22 cm,15 pages,,Program booklets|~|Memorial service programs,,,,,,Barbados,,Barbados Department of Archives,text,public domain,Barbados Department of Archives,,Funerals|~|Funeral service,Saint Michael (Barbados),21st Century,
