Object Type,Title,Item ARK,Parent ARK,File Name,AltTitle.other,collection.physical,Contents note,Date.created,Date.normalized,Description.latitude,Description.longitude,Description.note,Format.dimensions,Format.extent,Format.medium,Genre,Language,Local identifier,Name.creator,Named subject,Note,Place of origin,Publisher.publisherName,Repository,Resource type,Rights.copyrightStatus,Rights.rightsHolderContact,Statement of Responsibility,Subject,Subject geographic,Subject temporal,Creator
Work,"Queen's College Presents a Christmas Show: ""Tang '76""",ark:/21198/z13r2kx9,ark:/21198/z1rf7n15,afddsf/barb_eph_kq0147.pdf,Queen's College,Ephemera Collection,,December 1976,1976-12,13.1939,59.5432,"Booklet with program and information about a Christmas show of music, dance, and gymnastics organized by the Queen's College in December 1976. The booklet also includes the lyrics of songs performed.",21.7 cm x 17.7 cm,18 pages,,Program booklets|~|Theater programs|~|Christmas plays,,,Queen's College,,,Barbados,,Barbados Department of Archives,text,public domain,Barbados Department of Archives,,Theater|~|College theatricals|~|Christmas plays,Saint Michael (Barbados),20th Century,
Work,"Queen's College Presents a Rock Pantomime: ""The Old woman in the Shoe""",ark:/21198/z1001v7r,ark:/21198/z1rf7n15,afddsf/barb_eph_kq0148.pdf,Queen's College,Ephemera Collection,,December 1972,1972-12,13.1939,59.5432,"Booklet with program and information about the rock pantomime ""The Old Woman in the Shoe"" organized by Queen's College in December 1972.",16.8 cm x 21.8 cm; 11.2 cm x 16.1 cm,9 pages,,Program booklets|~|Theater programs|~|Pantomimes,,,Queen's College,,,Barbados,,Barbados Department of Archives,text,public domain,Barbados Department of Archives,,Pantomimes|~|School plays|~|Theather,Saint Michael (Barbados),20th Century,
Work,"The Barbados National Trust presents ""Barbados Remembered: An Exhibition of the Historical Photographs of Barbadian Euchard Fitzpatrick""",ark:/21198/z1v71bq0,ark:/21198/z1rf7n15,afddsf/barb_eph_kq0149.pdf,The Barbados National Trust,Ephemera Collection,,May 1993,1993-05,13.1939,59.5432,"Brochure for an exhibition of historical photographs by Barbadian Euchard Fitzpatrick presented by the Barbados National Trust. The exhibition took place on May 17-29, 1993, at the Grande Salle, Frank Collymore Hall, Central Bank Building, Bridgetown.",21.5 cm x 17.5 cm,4 pages,,Brochures|~|Exhibition posters,,,Barbados National Trust,,,Barbados,,Barbados Department of Archives,text,public domain,Barbados Department of Archives,,Photography|~|Photographs--Exhibitions,Saint Michael (Barbados),20th Century,
Work,Canada: Stones of History,ark:/21198/z1qg0kzt,ark:/21198/z1rf7n15,afddsf/barb_eph_kq0150.pdf,,Ephemera Collection,,Between 2000 and 2010,2000/2010,13.1939,59.5432,Brochure for photographic exhibition about Canada's Houses of Parliament.,24.1 cm x 12.7 cm,7 pages,,Brochures|~|Exhibition posters,,,Embassy of Canada,,,Barbados,,Barbados Department of Archives,text,public domain,Barbados Department of Archives,,Photography|~|Photographs--Exhibitions,Saint Michael (Barbados),21st Century,
Work,Ina Brathwaite: Piano Recital,ark:/21198/z1kp9v6h,ark:/21198/z1rf7n15,afddsf/barb_eph_kq0151.pdf,,Ephemera Collection,,"January 23, 1939",1939-01-23,13.1939,59.5432,"Booklet with program for the piano recital of pianist Ina Braithwaite. The recital took place at Jordan Hall in Boston, Massachusetts, on January 23, 1939.",19.9 cm x 14 cm,8 pages,,Program booklets|~|Event programs|~|Concert programs,,,Jordan Hall,,,USA,,Barbados Department of Archives,text,public domain,Barbados Department of Archives,,Recitals (music)|~|Piano,U.S.A.,20th Century,
Work,Piano Recital: Janna Dawson,ark:/21198/z1fx93j2,ark:/21198/z1rf7n15,afddsf/barb_eph_kq0152.pdf,,Ephemera Collection,,"March 14, 1958",1958-03-14,13.1939,59.5432,"Brochure for a piano recital by Janna Dawson, presented by Mrs. Olga Ramsay, at Harrison College on March 14, 1958.",20 cm x 14.1 cm,4 pages,,Brochures|~|Concert programs,,,Olga Ramsay,,,Barbados,,Barbados Department of Archives,text,public domain,Barbados Department of Archives,,Recitals (music)|~|Piano,Saint Michael (Barbados),20th Century,
Work,"Youth Program for West Indian Tour 1964 by Philippa Schuyler, Pianist",ark:/21198/z1b58bv3,ark:/21198/z1rf7n15,afddsf/barb_eph_kq0153.pdf,,Ephemera Collection,,1964,1964,13.1939,59.5432,Flyer for a piano recital performed by pianist Philippa Schuyler for her West Indian tour in 1964. The program was intended for young audiences.,29.1 cm x 21.5 cm,1 page,,Fliers|~|Concert programs,,,Philippa Schuyler,,,Barbados,,Barbados Department of Archives,text,public domain,Barbados Department of Archives,,Recitals (music)|~|Piano,,20th Century,
Work,Piano Recital: Ray Luck,ark:/21198/z16h69hn,ark:/21198/z1rf7n15,afddsf/barb_eph_kq0154.pdf,,Ephemera Collection,,"August 20, 1965",1965-08-20,13.1939,59.5432,"Brochure for a piano recital by Ray Luck organized by the Barbados Arts Council. The event took place at Queen's College Hall on August 20, 1965.",16.5 cm x 20.4 cm,4 pages,,Brochures|~|Concert programs,,,Barbados Arts Council,,,Barbados,,Barbados Department of Archives,text,public domain,Barbados Department of Archives,,Recitals (music)|~|Piano,Saint Michael (Barbados),20th Century,
Work,Piano Recital: Frank Fernandes,ark:/21198/z12r5jtc,ark:/21198/z1rf7n15,afddsf/barb_eph_kq0155.pdf,,Ephemera Collection,,"August 18, 1967",1967-08-18,13.1939,59.5432,"Brochure for a piano recital by Frank Fernandes that took place at the Ursuline Convent on August 18, 1967.",21.7 cm x 16.5 cm,3 pages,,Brochures|~|Concert programs,,,Barbados Arts Council,,,Barbados,,Barbados Department of Archives,text,public domain,Barbados Department of Archives,,Recitals (music)|~|Piano,Saint Michael (Barbados),20th Century,
Work,Ray Luck,ark:/21198/z1z0527f,ark:/21198/z1rf7n15,afddsf/barb_eph_kq0156.pdf,,Ephemera Collection,,Between 1970 and 1985,1970/1985,13.1939,59.5432,"Brochure for a piano recital by Ray Luck, Guyanese pianist. The brochure contains biographical information about Ray Luck, as well as information on his career, but no further information on location or date of this performance has been provided. It might have possibly been distributed together with the sheet with the program of a recital by Ray Luck performed in Barbados at the Ursuline Convent on July 7, 1978.",24 cm x 13.9 cm,4 pages,,Brochures|~|Concert programs,,,Ray Luck,,,Guyana,,Barbados Department of Archives,text,public domain,Barbados Department of Archives,,Recitals (music)|~|Piano,Saint Michael (Barbados),20th Century,
Work,Piano Recital: Frank Fernandes,ark:/21198/z1t749g8,ark:/21198/z1rf7n15,afddsf/barb_eph_kq0157.pdf,,Ephemera Collection,,"February 24, 1972",1972-02-24,13.1939,59.5432,"Brochure with the program for a piano recital by Frank Fernandes that took place probably at Harrison College on February 24, 1972.",14 cm x 21.6 cm,2 pages,,Brochures|~|Concert programs,,,Music Club,,,Barbados,,Barbados Department of Archives,text,public domain,Barbados Department of Archives,,Recitals (music)|~|Piano,Saint Michael (Barbados),20th Century,
Work,Piano Recital: James Gibb,ark:/21198/z1pg3jrj,ark:/21198/z1rf7n15,afddsf/barb_eph_kq0158.pdf,,Ephemera Collection,,"November 3, 1975",1975-11-03,13.1939,59.5432,"Booklet with the program for a piano recital by James Gibb presented by the Music Club under the auspices of the British Council. The event took place at Harrison College on November 3, 1975.",20.4 cm x 16 cm,4 pages,,Program booklets|~|Event programs|~|Concert programs,,,Music Club|~|British Council,,,Barbados,,Barbados Department of Archives,text,public domain,Barbados Department of Archives,,Recitals (music)|~|Piano,Saint Michael (Barbados),20th Century,
Work,Piano Recital: Ian Lake,ark:/21198/z1jq2t2p,ark:/21198/z1rf7n15,afddsf/barb_eph_kq0159.pdf,,Ephemera Collection,,"March 26, 1976",1976-03-26,13.1939,59.5432,"Brochure with the program for a piano recital by Ian Lake presented by the Barbados Arts Council at Harrison College on March 26, 1976.",15.2 cm x 13.9 cm,4 pages,,Brochures|~|Concert programs,,,Barbados Arts Council,,,Barbados,,Barbados Department of Archives,text,public domain,Barbados Department of Archives,,Recitals (music)|~|Piano,Saint Michael (Barbados),20th Century,
Work,Pianoforte Recital: Rainer Von Zastrow,ark:/21198/z1dz22fp,ark:/21198/z1rf7n15,afddsf/barb_eph_kq0160.pdf,,Ephemera Collection,,"January 14, 1977",1977-01-14,13.1939,59.5432,"Brochure with the program for a pianoforte recital by Rainer Von Zastrow, organized by the Committee of Management of the Barbados Association for Mentally Retarded Children. The event took place at Harrison College Hall on January 14, 1977.",21.7 cm x 14.1 cm,8 pages,,Brochures|~|Concert programs,,,Barbados Association for Mentally Retarded Children,,,Barbados,,Barbados Department of Archives,text,public domain,Barbados Department of Archives,,Recitals (music)|~|Piano,Saint Michael (Barbados),20th Century,
Work,Piano Concert: Ray Luck,ark:/21198/z1990140,ark:/21198/z1rf7n15,afddsf/barb_eph_kq0161.pdf,,Ephemera Collection,,"July 7, 1978",1978-07-07,13.1939,59.5432,"Sheet with program for a piano concert by Ray Luck, Guyanese pianist, presented by the Barbados Arts Council at the Ursuline Convent on July 7, 1978. More information about the artist can be found in an accompanying brochure in this collection.",21.6 cm x 14 cm,2 pages,,Fliers|~|Concert programs,,,Barbados Arts Council|~|Barbados Funeral Directors Association,,,Barbados,,Barbados Department of Archives,text,public domain,Barbados Department of Archives,,Recitals (music)|~|Piano|~|Concerts,Saint Michael (Barbados),20th Century,
Work,Musical Recital: Marjorie Mitchell,ark:/21198/z15h98dq,ark:/21198/z1rf7n15,afddsf/barb_eph_kq0162.pdf,,Ephemera Collection,,"February 11, 1982",1982-02-11,13.1939,59.5432,"Brochure with the program for a piano recital by Marjorie Mitchell presented by the Barbados Association for the Mentally Retarded Children at the Combermere Auditorium on February 11, 1982.",21.6 cm x 14 cm,4 pages,,Brochures|~|Concert programs,,,Barbados Association for Mentally Retarded Children,,,Barbados,,Barbados Department of Archives,text,public domain,Barbados Department of Archives,,Recitals (music)|~|Piano,Saint Michael (Barbados),20th Century,
Work,"""Talk Yuh Talk"": An Evening with the Poetic Works of Bruce St. John",ark:/21198/z11r8hnj,ark:/21198/z1rf7n15,afddsf/barb_eph_kq0163.pdf,,Ephemera Collection,,Between 1975 and 1990,1975/1990,13.1939,59.5432,"Booklet with the program of a theatrical production based on poems by Bruce St. John, Barbadian poet, who interspersed his poems with the voice of the folk and the language of the people. The booklet contains information about the performing actors, the director, and the poet. No location or date information provided.",27.1 cm x 21.8 cm,6 pages,,Program booklets|~|Theater programs,,,Milton McCollin,,,Barbados,,Barbados Department of Archives,text,public domain,Barbados Department of Archives,,Theater,,20th Century,
Work,Polo Barbados Challenge Trophy,ark:/21198/z1x08132,ark:/21198/z1rf7n15,afddsf/barb_eph_kq0164.pdf,,Ephemera Collection,,June 2007,2007-06,13.1939,59.5432,"Booklet with information about the Polo Barbados Challenge Trophy that took place in Canada between June 21-24, 2007. The booklet contains information on the teams, polo in Barbados, and several marketing advertisements by sponsors.",25.3 cm x 16.6 cm,16 pages,,Program booklets|~|Event programs,,,Toronto Polo Club,,,Canada,,Barbados Department of Archives,text,public domain,Barbados Department of Archives,,Polo|~|Polo players|~|Polo--Tournaments,Canada,21st Century,
Work,International Cycle and Athletic Sports,ark:/21198/z1s778cb,ark:/21198/z1rf7n15,afddsf/barb_eph_kq0165.pdf,,Ephemera Collection,,Between May and June 1953,1953-05/1953-06,13.1939,59.5432,"Booklet with the program and information about the international cycle and athletic sports competition, organized by the Amateur Athletic Association of Barbados, that took place at Kensington Oval on May 25 and 28, and June 3, 1953. The booklet contains the schedule of events and names of competitors, staff, and officials.",21.5 cm x 14.2 cm,44 pages,,Program booklets|~|Event programs,,,Amateur Athletic Association of Barbados,,,Barbados,,Barbados Department of Archives,text,public domain,Barbados Department of Archives,,"Athletics|~|Sports|~|Competitions|~|Kensington Oval (Bridgetown, Barbados)",Saint Michael (Barbados),20th Century,
Work,Programme of Coronation Celebrations for Her Majesty Queen Elizabeth,ark:/21198/z1ng6hqh,ark:/21198/z1rf7n15,afddsf/barb_eph_kq0166.pdf,,Ephemera Collection,,"Between May 23 and June 6, 1953",1953-05-23/1953-06-06,13.1939,59.5432,"Booklet with the program of activities and celebrations on the occasion of the coronation of Queen Elizabeth II. The celebrations were organized by the Coronation Committee of Barbados and took place from May 23 to June 6, 1953. The booklet contains information on the Coronation Committee, program of events and various locations throughout the island, religious ceremonies, receptions, performances, etc.",25.1 cm x 18.2 cm,12 pages,,Program booklets|~|Event programs,,,Coronation Committee of Barbados,,,Barbados,,Barbados Department of Archives,text,public domain,Barbados Department of Archives,,Coronations|~|Kings and rulers--coronation|~|Crowning of sovereigns|~|Celebrations,,20th Century,
Work,Recital of Music Celebrating the Coronation of Her Majesty Queen Elizabeth II,ark:/21198/z1hq5s23,ark:/21198/z1rf7n15,afddsf/barb_eph_kq0167.pdf,,Ephemera Collection,,"June 8, 1953",1953-06-08,13.1939,59.5432,"Souvenir program booklet for the recital of music celebrating the coronation of Queen Elizabeth II by the augmented combined choirs of St. Paul's and St. Mary's. The recital took place at St. Paul's Church on June 8, 1953.",20.2 cm x 13.2 cm,7 pages,,Program booklets|~|Event programs|~|Souvenir programs,,,Coronation Committee of Barbados,,,Barbados,,Barbados Department of Archives,text,public domain,Barbados Department of Archives,,Coronations|~|Kings and rulers--coronation|~|Crowning of sovereigns|~|Celebrations|~|Recitals (music),Saint Michael (Barbados),20th Century,
Work,Queen Elizabeth Hospital: Open Day,ark:/21198/z1d23qqj,ark:/21198/z1rf7n15,afddsf/barb_eph_kq0168.pdf,,Ephemera Collection,,"May 26, 1971",1971-05-26,13.1939,59.5432,"Brochure with the program of the official ceremony for the open day at Queen Elizabeth Hospital on May 26, 1971.",16.5 cm x 20.8 cm,4 pages,,Brochures|~|Event programs,,,Queen Elizabeth Hospital,,,Barbados,,Barbados Department of Archives,text,public domain,Barbados Department of Archives,,Ceremonies|~|Hospitals,Saint Michael (Barbados),20th Century,
Work,"Official Opening of Queen Elizabeth Hospital by H. R. H. the Prince Philip, Duke of Edinburgh",ark:/21198/z1893012,ark:/21198/z1rf7n15,afddsf/barb_eph_kq0169.pdf,,Ephemera Collection,,"November 14, 1964",1934-11-14,13.1939,59.5432,"Booklet with the program of activities and information about the official opening of Queen Elizabeth Hospital by Prince Philip, Duke of Edinburgh, on November 14, 1964.",16.1 cm x 12.4 cm,9 pages,,Program booklets|~|Event programs,,,Government of Barbados,,,Barbados,,Barbados Department of Archives,text,public domain,Barbados Department of Archives,,Ceremonies|~|Hospitals,Saint Michael (Barbados),20th Century,
Work,Queen Elizabeth Hospital Casualty and Out-Patients Department,ark:/21198/z14j2760,ark:/21198/z1rf7n15,afddsf/barb_eph_kq0170.pdf,,Ephemera Collection,,1971,1971,13.1939,59.5432,Brochure with information about the Casualty and Out-Patients Department at Queen Elizabeth Hospital. The brochure contains statistics about the year 1970.,21.6 cm x 12.7 cm,2 pages,,Brochures,,,Government of Barbados,,,Barbados,,Barbados Department of Archives,text,public domain,Barbados Department of Archives,,Hospitals|~|Hospitals--Outpatient services,Saint Michael (Barbados),20th Century,
Work,Queen Elizabeth Hospital - Tenth Anniversary Celebrations,ark:/21198/z10s1gft,ark:/21198/z1rf7n15,afddsf/barb_eph_kq0171.pdf,,Ephemera Collection,,November 1964,1964-11,13.1939,59.5432,"Brochure with the program of activities for the 10th anniversary celebrations of Queen Elizabeth Hospital that took place from November 10-16, 1974.",21.6 cm x 16.5 cm,4 pages,,Brochures|~|Event programs,,,Government of Barbados,,,Barbados,,Barbados Department of Archives,text,public domain,Barbados Department of Archives,,Anniversaries|~|Celebrations|~|Hospitals,Saint Michael (Barbados),20th Century,
Work,Invitation to Opening Ceremony of Queen Elizabeth Hospital,ark:/21198/z1w10zzf,ark:/21198/z1rf7n15,afddsf/barb_eph_kq0172.pdf,,Ephemera Collection,,"November 14, 1964",1961-11-14,13.1939,59.5432,"Invitation by the Government of Barbados to Sir Grantley Adams and Lady Adams for the opening ceremony of Queen Elizabeth Hospital by H.R.H. the Duke of Edinburgh on November 14, 1964 with a reception at the roof of the hospital.",13.2 cm x 19 cm,1 page,,Invitations,,,Government of Barbados,,,Barbados,,Barbados Department of Archives,text,public domain,Barbados Department of Archives,,Ceremonies|~|Hospitals,Saint Michael (Barbados),20th Century,
Work,Queen Elizabeth Hospital: The Recovery Room Open Day,ark:/21198/z1r8079d,ark:/21198/z1rf7n15,afddsf/barb_eph_kq0173.pdf,,Ephemera Collection,,"May 26, 1971",1971-05-26,13.1939,59.5432,"Flyer for the open day of the Recovery Room at Queen Elizabeth Hospital that took place on May 26, 1971. The flyer contains information and statistics about the Recovery Room.",33.9 cm x 21.6 cm,2 pages,,Fliers,,,Government of Barbados,,,Barbados,,Barbados Department of Archives,text,public domain,Barbados Department of Archives,,Hospitals,Saint Michael (Barbados),20th Century,
Work,"Programme for the Visit to St. Elizabeth School by Her Majesty Queen Elizabeth II and H.R.H The Prince Philip, Duke of Edinburgh",ark:/21198/z1mg9gmk,ark:/21198/z1rf7n15,afddsf/barb_eph_kq0174.pdf,,Ephemera Collection,,"February 15, 1966",1966-02-15,13.1939,59.5432,"Booklet with the schedule of activities during the visit to St. Elizabeth School by Queen Elizabeth II and Prince Philip and the unveiling of a plaque on February 15, 1966.",17 cm x 12.7 cm,6 pages,,Program booklets|~|Event programs,,,Government of Barbados,,,Barbados,,Barbados Department of Archives,text,public domain,Barbados Department of Archives,,Visits of state|~|Royal visits|~|Schools,Saint Joseph (Barbados),20th Century,
Work,"Visit to Barbados by Her Majesty Queen Elizabeth II and His Royal Highness The Prince Philip, Duke of Edinburgh",ark:/21198/z1gt7f84,ark:/21198/z1rf7n15,afddsf/barb_eph_kq0175.pdf,,Ephemera Collection,,February 1975,1975-02,13.1939,59.5432,"Booklet with the program of the visit to Barbados of Queen Elizabeth II and Prince Philip between February 18-20, 1975. The booklet contains an outline of the program, routes to be travelled by the royal party, order of cars for all processions, list of the party, and the detailed schedule of activities in various locations throughout the country.",18.7 cm x 14.1 cm,56 pages,,Program booklets|~|Event programs,,,Government of Barbados,,,Barbados,,Barbados Department of Archives,text,public domain,Barbados Department of Archives,,Visits of state|~|Royal visits,,20th Century,
Work,"Visit to Barbados by Her Majesty Queen and His Royal Highness The Prince Philip, Duke of Edinburgh - Baggage and Transport Detail",ark:/21198/z1c26pk5,ark:/21198/z1rf7n15,afddsf/barb_eph_kq0176.pdf,,Ephemera Collection,,February 1975,1975-02,13.1939,59.5432,"Booklet with details for the baggage and transport during the visit to Barbados of Queen Elizabeth II and Prince Philip between February 18-20, 1975. The booklet outlines transport used, protection provided, procession of the royal party and staff, and baggage carried.",15.2 cm x 21.2 cm,70 pages,,Program booklets|~|Event programs,,,Government of Barbados,,,Barbados,,Barbados Department of Archives,text,public domain,Barbados Department of Archives,,Visits of state|~|Royal visits|~|Heads of state--Travel|~|Luggage|~|Baggage,,20th Century,
Work,Notes About Barbados,ark:/21198/z1795xr3,ark:/21198/z1rf7n15,afddsf/barb_eph_kq0177.pdf,,Ephemera Collection,,February 1975,1975-02,13.1939,59.5432,"Booklet titled ""Notes about Barbados for the occasion of the Visit of Her Majesty The Queen and the Duke of Edinburgh, 18-20 February, 1975."" The booklet contains information about Barbados, such as geography, language and population, government, national flag and anthem, and notes on places visited by the royal party.",19.2 cm x 12.7 cm,14 pages,,Program booklets|~|Event programs,,,Government of Barbados,,,Barbados,,Barbados Department of Archives,text,public domain,Barbados Department of Archives,,Visits of state|~|Royal visits,,20th Century,
Work,Dinner at Government House - Invitation,ark:/21198/z13j560q,ark:/21198/z1rf7n15,afddsf/barb_eph_kq0178.pdf,,Ephemera Collection,,"February 18, 1975",1975-02-18,13.1939,59.5432,"Blank invitation to a dinner at the Government House on February 18, 1975, on the occasion of the visit of Queen Elizabeth and the Duke of Edinburgh.",15.2 cm x 20.3 cm,2 pages,,Invitations,,,Government of Barbados,,,Barbados,,Barbados Department of Archives,text,public domain,Barbados Department of Archives,,Visits of state|~|Royal visits|~|Dinners and dining|~|Invitations,Saint Michael (Barbados),20th Century,
Work,Dinner at Government House - Dinner Menu,ark:/21198/z1zs4pjg,ark:/21198/z1rf7n15,afddsf/barb_eph_kq0179.pdf,,Ephemera Collection,,"February 18, 1975",1975-02-18,13.1939,59.5432,"Card with the menu at the Government House on February 18, 1975, on the occasion of the visit of Queen Elizabeth and the Duke of Edinburgh.",15.3 cm x 11.7 cm,2 pages,,Menus,,,Government of Barbados,,,Barbados,,Barbados Department of Archives,text,public domain,Barbados Department of Archives,,Visits of state|~|Royal visits|~|Dinners and dining|~|Menus,Saint Michael (Barbados),20th Century,
Work,Luncheon at Government House - Invitation,ark:/21198/z1v13xvh,ark:/21198/z1rf7n15,afddsf/barb_eph_kq0180.pdf,,Ephemera Collection,,"February 20, 1975",1975-02-20,13.1939,59.5432,"Blank invitation to a luncheon at the Government House on February 20, 1975, on the occasion of the visit of Queen Elizabeth and the Duke of Edinburgh.",15.2 cm x 20.2 cm,2 pages,,Invitations,,,Government of Barbados,,,Barbados,,Barbados Department of Archives,text,public domain,Barbados Department of Archives,,Visits of state|~|Royal visits|~|Luncheons|~|Invitations,Saint Michael (Barbados),20th Century,
Work,Luncheon at Government House - Menu,ark:/21198/z1q8366g,ark:/21198/z1rf7n15,afddsf/barb_eph_kq0181.pdf,,Ephemera Collection,,"February 20, 1975",1975-02-20,13.1939,59.5432,"Card with menu for a luncheon at the Government House on February 20, 1975, on the occasion of the visit of Queen Elizabeth and the Duke of Edinburgh.",15.3 cm x 11.5 cm,2 pages,,Menus,,,Government of Barbados,,,Barbados,,Barbados Department of Archives,text,public domain,Barbados Department of Archives,,Visits of state|~|Royal visits|~|Luncheons|~|Menus,Saint Michael (Barbados),20th Century,
Work,Reception at Government House - Invitation,ark:/21198/z1km14xh,ark:/21198/z1rf7n15,afddsf/barb_eph_kq0182.pdf,,Ephemera Collection,,"February 20, 1975",1975-02-20,13.1939,59.5432,"Blank invitation to a reception at the Government House on February 20, 1975, on the occasion of the visit of Queen Elizabeth and the Duke of Edinburgh.",15.2 cm x 20.3 cm,2 pages,,Invitations,,,Government of Barbados,,,Barbados,,Barbados Department of Archives,text,public domain,Barbados Department of Archives,,Visits of state|~|Royal visits|~|Invitations,Saint Michael (Barbados),20th Century,
Work,Reception at Government House - Admission Ticket and Parking Ticket,ark:/21198/z1fv0d5r,ark:/21198/z1rf7n15,afddsf/barb_eph_kq0183.pdf,,Ephemera Collection,,"February 20, 1975",1975-02-20,13.1939,59.5432,"Admission ticket and parking ticket for a press reception at the Government House on February 20, 1975, on the occasion of the visit of Queen Elizabeth and the Duke of Edinburgh.",6.4 cm x 10.2 cm; 8.9 cm x 12.6 cm,2 pages,,Admission tickets,,,Government of Barbados,,,Barbados,,Barbados Department of Archives,text,public domain,Barbados Department of Archives,,Visits of state|~|Royal visits|~|Press|~|Dinners and dining,Saint Michael (Barbados),20th Century,
Work,Presentation of Awards - Invitation,ark:/21198/z1b29ncw,ark:/21198/z1rf7n15,afddsf/barb_eph_kq0184.pdf,,Ephemera Collection,,"February 20, 1975",1975-02-20,13.1939,59.5432,"Blank invitation to the presentation of awards under the Duke of Edinburgh Award Scheme by Prince Philip, Duke of Edinburgh, at the Government House on February 20, 1975.",12.7 cm x 19 cm,1 page,,Invitations,,,Government of Barbados,,,Barbados,,Barbados Department of Archives,text,public domain,Barbados Department of Archives,,Visits of state|~|Royal visits|~|Invitations|~|Awards ceremonies|~|Ceremonies,Saint Michael (Barbados),20th Century,
Work,Presentation of Awards - Admission Ticket and Parking Ticket,ark:/21198/z1698wmq,ark:/21198/z1rf7n15,afddsf/barb_eph_kq0185.pdf,,Ephemera Collection,,"February 20, 1975",1975-02-20,13.1939,59.5432,"Admission ticket and parking ticket for the presentation of awards under the Duke of Edinburgh Award Scheme by Prince Philip, Duke of Edinburgh, at the Government House on February 20, 1975.",6.3 cm x 10.1 cm; 8.9 cm x 12.7 cm,1 page,,Admission tickets,,,Government of Barbados,,,Barbados,,Barbados Department of Archives,text,public domain,Barbados Department of Archives,,Visits of state|~|Royal visits|~|Awards ceremonies|~|Ceremonies,Saint Michael (Barbados),20th Century,
